[
  {
    "id": "CIBRC-TOM-EB-001",
    "crop": "Tomato",
    "condition": "Early Blight",
    "condition_type": "disease",
    "target": "Early blight (Alternaria solani)",
    "active_ingredient": "Mancozeb",
    "formulation": "75% WP",
    "registered_use": "Control of early blight (Alternaria solani) in tomato.",
    "approved_crop": "Tomato",
    "approved_target": "Early blight (Alternaria solani)",
    "application_method": "Foliar Spray",
    "dose": "1.5-2.0",
    "dose_unit": "kg/ha",
    "pre_harvest_interval": 3,
    "number_of_applications": null,
    "interval": null,
    "region_scope": "India",
    "source_id": "SRC-CIBRC-2024",
    "source_date": "2024-03-31",
    "verification_date": "2026-10-04",
    "verification_status": "verified",
    "notes": "FRAC Group M03 (Dithiocarbamate). Protectant contact fungicide with multi-site activity.",
    "safety_notes": "Blue triangle (Moderately Toxic). Waiting period (PHI): 3 days. Wear full PPE."
  },
  {
    "id": "CIBRC-TOM-EB-002",
    "crop": "Tomato",
    "condition": "Early Blight",
    "condition_type": "disease",
    "target": "Early blight",
    "active_ingredient": "Metiram + Pyraclostrobin",
    "formulation": "55% + 5% WG",
    "registered_use": "Control of early blight in tomato.",
    "approved_crop": "Tomato",
    "approved_target": "Early blight",
    "application_method": "Foliar Spray",
    "dose": "1500-1750",
    "dose_unit": "g/ha",
    "pre_harvest_interval": 5,
    "number_of_applications": null,
    "interval": null,
    "region_scope": "India",
    "source_id": "SRC-CIBRC-2024",
    "source_date": "2024-03-31",
    "verification_date": "2026-10-04",
    "verification_status": "verified",
    "notes": "FRAC M03 + 11. Dual-action protectant and strobilurin translaminar fungicide.",
    "safety_notes": "Blue triangle. Waiting period (PHI): 5 days. Do not exceed 3 applications per season."
  },
  {
    "id": "CIBRC-TOM-EB-003",
    "crop": "Tomato",
    "condition": "Early Blight",
    "condition_type": "disease",
    "target": "Early blight",
    "active_ingredient": "Difenoconazole",
    "formulation": "25% EC",
    "registered_use": "Systemic control of early blight in tomato.",
    "approved_crop": "Tomato",
    "approved_target": "Early blight",
    "application_method": "Foliar Spray",
    "dose": "250-500",
    "dose_unit": "ml/ha",
    "pre_harvest_interval": 5,
    "number_of_applications": null,
    "interval": null,
    "region_scope": "India",
    "source_id": "SRC-CIBRC-2024",
    "source_date": "2024-03-31",
    "verification_date": "2026-10-04",
    "verification_status": "verified",
    "notes": "FRAC Group 3 (Triazole DMI). Systemic curative and protective action.",
    "safety_notes": "Yellow triangle (Highly Toxic). Waiting period (PHI): 5 days."
  },
  {
    "id": "CIBRC-TOM-EB-004",
    "crop": "Tomato",
    "condition": "Early Blight",
    "condition_type": "disease",
    "target": "Early blight",
    "active_ingredient": "Copper Oxychloride",
    "formulation": "50% WP",
    "registered_use": "Contact control of early blight in tomato.",
    "approved_crop": "Tomato",
    "approved_target": "Early blight",
    "application_method": "Foliar Spray",
    "dose": "2.5",
    "dose_unit": "kg/ha",
    "pre_harvest_interval": 3,
    "number_of_applications": null,
    "interval": null,
    "region_scope": "India",
    "source_id": "SRC-CIBRC-2024",
    "source_date": "2024-03-31",
    "verification_date": "2026-10-04",
    "verification_status": "verified",
    "notes": "FRAC Group M01 (Inorganic Copper). Broad spectrum multi-site protectant.",
    "safety_notes": "Blue triangle. Do not tank-mix with highly acidic inputs. Waiting period: 3 days."
  },
  {
    "id": "IPM-TOM-EB-001",
    "crop": "Tomato",
    "condition": "Early Blight",
    "condition_type": "disease",
    "target": "Early blight",
    "active_ingredient": null,
    "formulation": null,
    "registered_use": "Canopy ventilation, pruning lower infected foliage, and avoiding sprinkler splash.",
    "approved_crop": "Tomato",
    "approved_target": "Early blight",
    "application_method": "Agronomic Field Practice",
    "dose": null,
    "dose_unit": null,
    "pre_harvest_interval": null,
    "number_of_applications": null,
    "interval": null,
    "region_scope": "India",
    "source_id": "SRC-DPPQS-IPM-2022",
    "source_date": "2022-06-15",
    "verification_date": "2026-10-04",
    "verification_status": "verified",
    "notes": "Mulching with black polythene or organic straw reduces splash dispersal of Alternaria spores from soil.",
    "safety_notes": "Non-chemical preventive cultural measure."
  },
  {
    "id": "IPM-TOM-EB-002",
    "crop": "Tomato",
    "condition": "Early Blight",
    "condition_type": "disease",
    "target": "Soil-borne and foliar blight suppression",
    "active_ingredient": "Trichoderma harzianum",
    "formulation": "1% WP",
    "registered_use": "Bio-antagonist seed treatment and root zone drenching against fungal pathogens.",
    "approved_crop": "Tomato",
    "approved_target": "Soil-borne and foliar blight suppression",
    "application_method": "Seed Treatment / Root Drench",
    "dose": null,
    "dose_unit": null,
    "pre_harvest_interval": null,
    "number_of_applications": null,
    "interval": null,
    "region_scope": "India",
    "source_id": "SRC-DPPQS-IPM-2022",
    "source_date": "2022-06-15",
    "verification_date": "2026-10-04",
    "verification_status": "verified",
    "notes": "Fungal biocontrol agent that parasitizes pathogenic hyphae and induces systemic resistance.",
    "safety_notes": "Green triangle (Bio-pesticide). Non-hazardous to mammals and pollinators."
  },
  {
    "id": "CIBRC-TOM-LB-001",
    "crop": "Tomato",
    "condition": "Late Blight",
    "condition_type": "disease",
    "target": "Late blight (Phytophthora infestans)",
    "active_ingredient": "Cymoxanil + Mancozeb",
    "formulation": "8% + 64% WP",
    "registered_use": "Control of late blight in tomato.",
    "approved_crop": "Tomato",
    "approved_target": "Late blight (Phytophthora infestans)",
    "application_method": "Foliar Spray",
    "dose": null,
    "dose_unit": null,
    "pre_harvest_interval": 5,
    "number_of_applications": null,
    "interval": null,
    "region_scope": "India",
    "source_id": "SRC-CIBRC-2024",
    "source_date": "2024-03-31",
    "verification_date": "2026-10-04",
    "verification_status": "verified",
    "notes": "FRAC Group 27 + M03. Combines penetrant local curative action with protectant.",
    "safety_notes": "Blue triangle. Waiting period: 5 days. Spray immediately upon blight forecast."
  },
  {
    "id": "CIBRC-TOM-LB-002",
    "crop": "Tomato",
    "condition": "Late Blight",
    "condition_type": "disease",
    "target": "Late blight",
    "active_ingredient": "Dimethomorph",
    "formulation": "50% WP",
    "registered_use": "Oomycete cell wall synthesis inhibitor for late blight control.",
    "approved_crop": "Tomato",
    "approved_target": "Late blight",
    "application_method": "Foliar Spray",
    "dose": "1.0",
    "dose_unit": "kg/ha",
    "pre_harvest_interval": 5,
    "number_of_applications": null,
    "interval": null,
    "region_scope": "India",
    "source_id": "SRC-CIBRC-2024",
    "source_date": "2024-03-31",
    "verification_date": "2026-10-04",
    "verification_status": "verified",
    "notes": "FRAC Group 40 (CAA fungicide). Highly active against sporangia and oospores.",
    "safety_notes": "Blue triangle. Waiting period: 5 days. Must be tank mixed or rotated with protectant."
  },
  {
    "id": "IPM-TOM-LB-001",
    "crop": "Tomato",
    "condition": "Late Blight",
    "condition_type": "disease",
    "target": "Late blight",
    "active_ingredient": null,
    "formulation": null,
    "registered_use": "Proactive monitoring during overcast high-humidity periods and elimination of cull piles.",
    "approved_crop": "Tomato",
    "approved_target": "Late blight",
    "application_method": "Field Sanitation & Scouting",
    "dose": null,
    "dose_unit": null,
    "pre_harvest_interval": null,
    "number_of_applications": null,
    "interval": null,
    "region_scope": "India",
    "source_id": "SRC-DPPQS-IPM-2022",
    "source_date": "2022-06-15",
    "verification_date": "2026-10-04",
    "verification_status": "verified",
    "notes": "Avoid flood irrigation in poorly drained soil. Remove and deep-bury heavily blighted foliage.",
    "safety_notes": "Cultural hygiene prevents epidemic spread across neighboring plots."
  },
  {
    "id": "CIBRC-TOM-BS-001",
    "crop": "Tomato",
    "condition": "Bacterial Spot",
    "condition_type": "disease",
    "target": "Bacterial spot (Xanthomonas)",
    "active_ingredient": "Copper Oxychloride",
    "formulation": "50% WP",
    "registered_use": "Bacteriostatic control of bacterial spot and canker in tomato.",
    "approved_crop": "Tomato",
    "approved_target": "Bacterial spot (Xanthomonas)",
    "application_method": "Foliar Spray",
    "dose": "2.5",
    "dose_unit": "kg/ha",
    "pre_harvest_interval": 3,
    "number_of_applications": null,
    "interval": null,
    "region_scope": "India",
    "source_id": "SRC-CIBRC-2024",
    "source_date": "2024-03-31",
    "verification_date": "2026-10-04",
    "verification_status": "verified",
    "notes": "FRAC Group M01. Copper ions disrupt bacterial enzyme systems.",
    "safety_notes": "Blue triangle. Waiting period: 3 days."
  },
  {
    "id": "CIBRC-TOM-BS-002",
    "crop": "Tomato",
    "condition": "Bacterial Spot",
    "condition_type": "disease",
    "target": "Bacterial spot / canker",
    "active_ingredient": "Streptomycin Sulphate + Tetracycline Hydrochloride",
    "formulation": "90% + 10% SP",
    "registered_use": "Antibiotic formulation for bacterial disease suppression.",
    "approved_crop": "Tomato",
    "approved_target": "Bacterial spot / canker",
    "application_method": "Foliar Spray",
    "dose": null,
    "dose_unit": null,